{
	"name": "archive",
	"description": "Archive extraction library. Reads magic bytes to detect zip vs tar.",
	"version": "0.1.0",
	"dependencies": {
		"fs": { "path": "../fs" },
		"path": { "path": "../path" },
		"deflate-sys": { "git": "https://github.com/lde-org/deflate-sys" }
	},
	"devDependencies": {
		"lde-test": { "path": "../lde-test" },
		"fs": { "path": "../fs" },
		"env": { "path": "../env" },
		"path": { "path": "../path" }
	}
}
